date,employee_title,location,employee_status,review_title,years_at_company,helpful,pros,cons,advice_to_mgmt,rating_overall,rating_balance,rating_culture,rating_career,rating_comp,rating_mgmt,recommends,positive_outlook,approves_of_CEO
Sun Oct 16 2016 12:34:16 GMT-0400 (Eastern Daylight Time),,, ,Great Philadelphia area firm with serious emphasis on technology,I have been working at Susquehanna International Group (SIG),8,"Very smart people, dynamic and fast-paced atmosphere, opportunities for growth, free lunch, and great on-site perks like gym and wellness center.","Projects frequently change direction, or are reprioritized, because of changing market opportunities or regulations.",,5.0,,,,,,Recommends,Positive Outlook,Approves of CEO
Tue Oct 25 2016 23:03:27 GMT-0400 (Eastern Daylight Time), Equity Research Associate,"New York, NY",Current Employee ,Decent Place to Start Career but Leadership is Thoughtless,I have been working at Susquehanna International Group (SIG) full-time for more than a year,20,"SIG Equity Research is a solid place to start a career if you don’t have a top-tier college degree or previous experience at a leading Equity Research platform. The company will invest in you by sending you to modeling/writing classes, as well as sponsorship in the CFA program. Perks include free meals and casual dress code. Research Associates with 2-3 years experience can move to larger shops with better compensation, and occasionally the buyside.","SIG has a strong brand in the derivatives world, however the institutional equity business, namely Research and Research Sales, is an amateur organization at best. The idea that SIG will leverage its Options expertise to build a strong institutional equities business has been unsuccessful as most equity investors do not care to understand derivatives (and vice versa). Senior Analysts and salespeople are generally comprised of has-beens and never-will-be’s, which is par for the course at most small boutique operations. Leadership is the real concern, as the defacto head of the institutional brokerage operation is a SIG-lifer with little brokerage experience, employing self-serving sycophantic department heads beneath him. Sales tends to rule over the Research Department with little regard or understanding of the Research process (scheduling firm-wide meetings and other important events during earnings season). Salespeople are loathe to make outgoing calls, save for one or two, and are typically interested in heading to the bar by 4:05pm. The Director of Research is a former salesperson who embodies the company’s lack of understanding of how to run a research business. This individual lacks research experience (and the respect of many senior analysts and associates), making up for that with canned speeches about the bright future of the business. Nearly 25% of the company’s Senior Research Analysts defected to competing organizations in the past year as the business continues to shrink under current leadership. The firm has make some questionable hires to replace departed analysts, including individuals who have been out of Equity Research for more than 3-4 years. With the NYC office’s lease up for renewal in 2018 many believe the founders may cut their losses and shut the business entirely.",,2.0,3.0,3.0,4.0,2.0,1.0,Doesn't Recommend,Negative Outlook,
Wed Sep 14 2016 11:04:22 GMT-0400 (Eastern Daylight Time),,"Bala Cynwyd, PA"," in Bala Cynwyd, PA","Perfect Fit For Me (still, after 7+ years)!",I have been working at Susquehanna International Group (SIG),14,"-Smartest group of people I've ever worked with. -Everyone is a teacher and student. -Everyone is accountable. -Post-mortems are GOOD experiences! Nothing to fear here. No finger-pointing. Just fact-gathering and discussions around what happened, what do we do s/t to address the issue, l/t to address the issue. Focus is on how to prevent going forward. Soooo refreshing! -The numerous sick perks don't hurt :)","I don't personally have any but if you're someone who is driven by holding a title and climbing a corporate ladder, SIG isn't for you. Flat organization. But I like this. Internal transfers are encouraged so jumping to another department and learning that space is a great opportunity!",,5.0,5.0,5.0,5.0,5.0,5.0,Recommends,Positive Outlook,Approves of CEO
Wed Oct 05 2016 10:49:55 GMT-0400 (Eastern Daylight Time),,"Newark, DE","Oracle Database Administrator in Newark, DE",Database Administrator,I worked at Susquehanna International Group (SIG) for more than a year,6,Great people - real family,Very sensitive to the stock market,,5.0,5.0,5.0,5.0,5.0,5.0,Recommends,Neutral Outlook,Approves of CEO
Wed Oct 12 2016 20:08:58 GMT-0400 (Eastern Daylight Time), Software Developer,"Bala Cynwyd, PA",Current Employee ,Software Engineer,I have been working at Susquehanna International Group (SIG) full-time for more than 3 years,4,Good learning Collaborative interaction with team members Ability to experiment with new technologies,Not so good direction when it comes to advancement Average pay,,4.0,4.0,4.0,4.0,4.0,2.0,Recommends,Neutral Outlook,Approves of CEO
Fri Oct 07 2016 07:42:40 GMT-0400 (Eastern Daylight Time),,"Brooklyn, NY","Assistant Trader in Brooklyn, NY","A great place to learn, a weird place to stay",I worked at Susquehanna International Group (SIG) for more than a year,5,- Great pay - Great benefits - Co-workers are really friendly and helpful - Lots of opportunities to learn if you put yourself out there,- A lot of focus on mock trading for new ATs which simulates trading in the pits. Not a super useful skill anymore but its part of their core business model - Determination of your career path is done solely by a few people who are in charge of education but don't really interact with you much on a daily basis,,4.0,4.0,5.0,4.0,5.0,5.0,Recommends,Neutral Outlook,Approves of CEO
Mon Sep 26 2016 16:43:39 GMT-0400 (Eastern Daylight Time),,,Current Employee ,Cool place in philadelphia to work,I have been working at Susquehanna International Group (SIG) full-time,6,"Smart people, good pay, nice office, free lunch & breakfast","Long hours, in bala cynwyd",,5.0,,,,,,,,
Mon Sep 12 2016 07:22:11 GMT-0400 (Eastern Daylight Time), Technology,"Bala Cynwyd, PA",Current Employee ,Great fin-tech company that keeps getting better,I have been working at Susquehanna International Group (SIG) full-time for more than 10 years,10,"- Hard core tech engineering company - no better place to work in the region if you are in technology - period. - Laid back, gold coast atmosphere - Great benefits, good location - Encourages innovation, well thought out risk taking, and a great balance of individualism and teamwork - Always striving to be better, which keeps things fresh and exciting - comforting that SIG realizes it is not perfect and is constantly looking to improve. - Investments in its employees have increased significantly over the past few years. - Work life balance has improved drastically over the past few years - good job SIG for recognizing this and changing the culture for the good. - CIO is great","- Could be more transparent; most complaints I hear about SIG are due to a lack of understanding that leads to false assumptions and conclusions. There is a need for privacy/secrecy, but I think the balance between privacy/secrecy and transparency is slightly skewed too far towards privacy/secrecy.",,5.0,4.0,5.0,5.0,4.0,5.0,Recommends,Positive Outlook,Approves of CEO
Thu Oct 13 2016 19:37:04 GMT-0400 (Eastern Daylight Time),,"New York, NY"," in New York, NY","Mgt turnover, shifting strategy",I worked at Susquehanna International Group (SIG),3,Free meals but you have to be willing to work late nights,Questionable hires in Equity Research makes it had to keep talent,,1.0,1.0,2.0,1.0,2.0,,Doesn't Recommend,,Disapproves of CEO
Sat Aug 13 2016 01:35:49 GMT-0400 (Eastern Daylight Time),,"Bala Cynwyd, PA","Platform in Bala Cynwyd, PA",Great IT Opportunities Available,I have been working at Susquehanna International Group (SIG) for more than a year,6,Many resources available to driven people. Leadership supports even new team members and guides improvement of the groups. Sweeping changes are able to be made for the betterment of the company. Flat organization is great for approaching different teams and working within other areas of the SIG..,Some teams have become stagnant and could use more motivation. Pace of work leaves little time for training or non-critical tasks.,,5.0,4.0,4.0,5.0,5.0,5.0,Recommends,Positive Outlook,Approves of CEO
Fri Jul 29 2016 16:31:33 GMT-0400 (Eastern Daylight Time), Technology,"Philadelphia, PA",Current Employee ,Still great,I have been working at Susquehanna International Group (SIG) full-time for more than 8 years,9,"Flat structure, if you can make an impact the sky is the limit for your career growth. New challenges every day!","Some wish for more tech in Chicago or NY, but the Bala cost of living is hard to beat!",,5.0,5.0,5.0,5.0,4.0,4.0,Recommends,Positive Outlook,Approves of CEO
Mon Aug 08 2016 09:45:48 GMT-0400 (Eastern Daylight Time), Software Developer,"Bala Cynwyd, PA",Former Employee ,Great place to start your career,I worked at Susquehanna International Group (SIG) full-time for more than 8 years,6,"Bright and collaborative co-workers, groups compete but are generally respectful of each other, fair management, strong leadership.","Somewhat cliquey culture at the top, top-end bonus or pay structure not available so there is a pay ceiling no matter how well you do for the firm.",,5.0,5.0,5.0,5.0,4.0,5.0,Recommends,Positive Outlook,Approves of CEO
Sun Aug 21 2016 05:33:40 GMT-0400 (Eastern Daylight Time), Equity Research Associate,"Bala Cynwyd, PA",Current Employee ,Equity options research analyst,I have been working at Susquehanna International Group (SIG) full-time for more than 8 years,2,"Smart coworkers, flat management style, freedom on how to pursue opportunities. Cooperative group, and the workplace is friendly and fun","Education process for research could be better, and the education reimbursement issue not great. Transparency in salaries is also a con.",,5.0,5.0,5.0,5.0,3.0,5.0,Recommends,Positive Outlook,Approves of CEO
Tue Aug 02 2016 09:42:03 GMT-0400 (Eastern Daylight Time),,, ,Assistant,I have been working at Susquehanna International Group (SIG),4,Everyone is very friendly and responsive. Get things done in a timely manner.,None to report at the moment.,,4.0,,,,,,,,
Mon Jul 11 2016 13:33:10 GMT-0400 (Eastern Daylight Time), Trader,"Bala Cynwyd, PA",Former Employee ,"Sterile, nerdy, masculine energy",I worked at Susquehanna International Group (SIG) full-time for more than a year,33,They know how to trade well and are good at rational thinking. The Assistant Trader internship might be the best internship in America. The poker culture is also solid even though the founders and higher ups (not talking about BC/JA) think about the game the way one would in the early 2000's and not the mid 2010's.,"No diversity: almost all of the decision-making is done by white males. Only women they visibly hire are in HR – they will do their best to include the few minorities/women that they do hire in every recruiting picture possible. (Look for repeating faces it's hilarious) They will brag about their education department but it really isn't that incredible. Any real trader you ask will tell you how everything you'll learn about trading happens on the floor, talking to other practicing traders. There is one sharp fellow who was in education when I left, and I'm not sure why he isn't on the floor instead. The other two clowns up there are a soccer mom and a pompous neanderthal There's another issue that at least applies to incoming Assistant Traders, which is: at every point in your lifetime at SIG, you will be ""priced in"" to continue to the next level. At no point do you ever think it's a ""rational"" decision to stop working there. For starters, they pay interns more than anyone else, and give the best intern experience possible. This sells you on the idea of becoming an AT. Then you're an AT and grind pretty hard to make trading class, so how could you possibly leave SIG after you make it to that? In doing so, you sign a non-compete and lock yourself into a non-competitive salary (for trading) for the next 3 years. You've committed to living in Philadelphia for the next 1000 days, with the promise of cashing in on the first year after the non-compete. Then after you think your payday has arrived, they shoot you a lowball offer since they are well-aware you already have a stable girlfriend/maybe wife, are planning to have kids, already call Philadelphia ""home"", etc. At every stage of your relationship with this company, they are so deliberately thinking about how to extract maximum value out of their employees. There's no upward mobility any more. They've got everything in place, and it's REALLY tough to move up. If it were 2000 I would say you should definitely go work at SIG for this reason. No more, now they're just looking for cogs to make the system run smoothly. Then there are the minor things. It's a company worth 11 figures, yet the office decor is bland and there's no color/art/character to the place at all. The food is repetitive and outside of the salad bar, pretty unappetizing and unhealthy. Overall, if you are in SIG's hiring set (white/asian male who is good at math and has some common sense), you should either work: – at a smaller trading firm with people who have better taste (you'll work longer hours for more reward), OR – at a larger tech company like an Uber or Facebook, where it's still homogenous but at least you'll have laxer hours & good food, can live in a better city, and there's a bit more upward mobility, OR – grind it out at a small startup where you aren't drawing dead to win big, even though the hours will be rougher",,2.0,3.0,1.0,1.0,3.0,1.0,Doesn't Recommend,Positive Outlook,Approves of CEO
Thu Jun 30 2016 12:47:51 GMT-0400 (Eastern Daylight Time),,, ,Top Phillly Employer,I have been working at Susquehanna International Group (SIG),9,"I work with smart, reliable colleagues who care about the job. I have the opportunity to solve challenging problems, with the freedom and resources to solve them properly. Creativity is encouraged and supported. Bureaucracy is minimal.","The company lacks top-of-market compensation for top talent. There is a fair amount of opportunity for training and professional development, but don't expect to hit multiple conferences or training courses each year. You're on your own for certifications and cert maintenance. That said, overall I'd say that what they lack in premium compensation and profession development they by far make up for in challenging work, benefits, balance, and culture.",,5.0,5.0,5.0,4.0,4.0,5.0,Doesn't Recommend,Negative Outlook,No opinion of CEO
Thu Jul 21 2016 14:31:18 GMT-0400 (Eastern Daylight Time),,"Bala Cynwyd, PA","Ops Analyst in Bala Cynwyd, PA",Operations Analyst,I have been working at Susquehanna International Group (SIG),3,Learn a ton about options trading and get experience programming,Extremely opinionated and pretentious traders,,3.0,4.0,3.0,1.0,1.0,2.0,Recommends,Positive Outlook,Approves of CEO
Sun May 01 2016 14:15:30 GMT-0400 (Eastern Daylight Time),,"Philadelphia, PA","Market Intelligence Analyst in Philadelphia, PA",Very positive experience at the Market Intelligence desk,I worked at Susquehanna International Group (SIG) for less than a year,9,Very friendly co-workers and a lot of nice perks like free lunch and gym.,"To be honest, nothing. The job required one week training prior and stated clearly for the hours it intends to keep you. I had a lot of learning experiences there.",,5.0,4.0,5.0,5.0,5.0,5.0,Recommends,Positive Outlook,Approves of CEO
Thu Apr 14 2016 04:29:12 GMT-0400 (Eastern Daylight Time),,"Bala Cynwyd, PA"," in Bala Cynwyd, PA",Ruthless - Watch your back at all times,I worked at Susquehanna International Group (SIG),30,In some ways this is a great company. Recession proof. Some pockets of great people in what was Enterprise Technology. Enterprise Services on the other hand is a snake pit. Lots of opportunity to learn on your own. Not so big on training. Great parties. People say the free food but you are supposed to work through lunch. People who went outside to walk around the parking lot for air and sunshine were told that looked unprofessional. It is fun to watch the helicopter land and take off from the pad.,"I worked here for ten years and watched clear favoritism with some employees allowed to skate through their job based on if a manager liked them or if they were attractive. Saw many hard working individuals treated poorly. People with tremendous results and reviews year after year kicked out when managers changed. At least they take very good care of management when letting them go, they get good packages. Regular employees? Often let go with no severance, and, due to a quirk in their system, if you have vacation unused or carried over from the previous year? You lose it all. That's right. Five year, no severance, no vacation pay, please leave right now. THey have a dark culture in some areas, ruling by fear and intimidation. Reminding you at all times that they can replace you and you are lucky to have a job. They did that during the 2008-2010 dip. No raises and no bonuses in some cases...as they explained...we do not have to give you raises just because a year has passed. THe market for jobs is tight. So we have the upper hand. So...no raises. Some people went five years without a raise. Then when things got better they were shocked, shocked I say, when some of the best talent left. I watched people work 60+ hour weeks out of fear that less would lead them to be fired. I watched middle managers groomed by their abusive bosses to pass that abuse down the chain. Fear and intimidation. Sad. Again, not in Enterprise Technology, while that existed, but in Enterprise Services. And always take your vacation at the beginning of the year so if you are let go they don't cheat you out of that.",,3.0,2.0,2.0,3.0,3.0,2.0,Doesn't Recommend,Positive Outlook,No opinion of CEO
Sun May 22 2016 17:48:10 GMT-0400 (Eastern Daylight Time),,"Bala Cynwyd, PA","Quantitative Research Associate in Bala Cynwyd, PA",analyst,I worked at Susquehanna International Group (SIG),3,flexible with opportunities to work on different projects,pay scale is not as competitive,,3.0,3.0,3.0,3.0,2.0,,,,
Tue Apr 05 2016 10:17:54 GMT-0400 (Eastern Daylight Time),,"Philadelphia, PA"," in Philadelphia, PA",Help Desk,I worked at Susquehanna International Group (SIG),6,"Friendly staff, great perks, overall great place!","Long hours, other than that pretty good!",,5.0,5.0,5.0,4.0,4.0,4.0,Recommends,Positive Outlook,Approves of CEO
Tue Apr 12 2016 20:16:08 GMT-0400 (Eastern Daylight Time), Team Lead,"Bala Cynwyd, PA",Former Employee ,Ruthless,I worked at Susquehanna International Group (SIG) full-time for more than 5 years,8,Flat organizational structure Entrepreneurial spirit Very smart employees Challenging and dynamic work environment,Outsized expectations 60 hour work weeks commonplace Ruthless internal politics Treat employees as disposable No real opportunities for advancement Attitudes and egos galore,,3.0,1.0,3.0,1.0,4.0,3.0,Doesn't Recommend,Neutral Outlook,Approves of CEO
Wed Mar 16 2016 13:59:18 GMT-0400 (Eastern Daylight Time),,, ,Intern,I worked at Susquehanna International Group (SIG),6,"Very helpful, motivated employees on all teams I encountered. Lunch is provided and improved goodwill among teams when eating together was the norm.",Some teams split on different floors.,,5.0,,,,,,,,
Tue Feb 23 2016 14:30:40 GMT-0500 (Eastern Standard Time), Analyst,"Philadelphia, PA",Current Employee ,Great company,I have been working at Susquehanna International Group (SIG) full-time for more than 3 years,8,"Great culture, great colleagues. Collegial environment, and benefits - free meals, great gym, relaxed dress code are awesome perks.","SIG does not pay top dollar. If you're all about the money, look elsewhere.",,4.0,4.0,5.0,4.0,3.0,3.0,Recommends,Positive Outlook,Approves of CEO
Thu Feb 11 2016 05:23:28 GMT-0500 (Eastern Standard Time),,, ,Equity Associate,I have been working at Susquehanna International Group (SIG),7,"Great people, great company, great benefits",Lots of hours and no notice for working long hours on the weekend,,5.0,4.0,5.0,5.0,5.0,4.0,Recommends,Positive Outlook,Approves of CEO
Fri Feb 05 2016 12:28:09 GMT-0500 (Eastern Standard Time),,,Current Employee ,good work life balance,I have been working at Susquehanna International Group (SIG) full-time for more than 3 years,8,"good work life balance, flexible working environment, free gym, free charging stations for electric cars, easy commute in suburban area","not competitive compensation, limited growth potential",,4.0,5.0,3.0,2.0,2.0,4.0,Positive Outlook,,Approves of CEO
Wed Feb 03 2016 09:44:31 GMT-0500 (Eastern Standard Time),,, ,Pleasant place to work.,I have been working at Susquehanna International Group (SIG),4,Open collaboration amongst technology teams is encouraged. Relaxed work environment although fast paced and intense at times. Able to set own career path.,Too many layers of middle and upper management. Approval process to get ideas and projects off the ground needs improvement. Health benefits are weak.,,4.0,3.0,4.0,3.0,2.0,3.0,Recommends,Neutral Outlook,Approves of CEO
Mon Nov 30 2015 07:20:51 GMT-0500 (Eastern Standard Time), Software Developer,"Bala Cynwyd, PA",Current Employee ,Software Developer - Great Perks and People,I have been working at Susquehanna International Group (SIG) full-time for less than a year,20,"I have only been here a short time, but I think I am here to stay. Amazing perks including free breakfast, lunch, and snacks every day. A new gym, that actually has everything you need, and I'm a pretty serious lifter. The gym also has beautiful individual private shower rooms with shampoo and body wash dispensers, your own sink, bench, and towel service. A game room with poker tables, pool tables, arcade games, video games consoles, virtual golf machines, and other stuff I can't think of. Electric car charging stations. Dry cleaning pickup and drop off. On-site car detailing and servicing (that and dry cleaning you have to pay for). An on-site nurse practitioner that is completely free. Fitness classes. An international poker tournament in addition to a bunch of other stuff. Aside from the amazing perks, it's also just a great place to work. There are so many talented and intelligent people, and you can walk up to any one of them and start a conversation. I was told a couple of the guys who started this company still show up to work everyday and sit right on the trading floor and talk with the employees. The pay is also good, but I don't know how the raises are yet.","Surprisingly mediocre benefits. Health insurance is either high deductible or high monthly cost with smaller deductible and you are not fully covered. 401k contributions are only %50 matched for the first %6 of your salary. There is also a vesting schedule of %20 per year, so you are not fully vested until you have been here for 5 years. Although the flat corporate structure is appealing in some aspects, there also appears to be little room to move up in the company and advance your career at least from a job title standpoint.",,5.0,5.0,5.0,3.0,4.0,5.0,Recommends,Positive Outlook,Approves of CEO
Wed Jan 20 2016 05:44:14 GMT-0500 (Eastern Standard Time),,"Philadelphia, PA"," in Philadelphia, PA",Assistant Trader,I worked at Susquehanna International Group (SIG),4,"There was a great atmosphere in the work place, working with intelligent like minded people makes work enjoyable. Stimulating work. Great perks such as food and gym","Long hours, can be stressful",,4.0,4.0,4.0,4.0,4.0,4.0,Recommends,Positive Outlook,Approves of CEO
Tue Feb 23 2016 10:10:44 GMT-0500 (Eastern Standard Time),,"Chicago, IL","Trader in Chicago, IL",Terrible work environment,I worked at Susquehanna International Group (SIG),15,"Free lunch, good hours and pay",Management is very secretive and does not value it's employees at all. Zero transparency and they will actually lie to your face. Lots of office politics and you feel like a number and are constantly looking over your shoulder. Not a good work environment at all and it is all because of management.,,1.0,3.0,1.0,1.0,4.0,1.0,Doesn't Recommend,Negative Outlook,Disapproves of CEO
Mon Jan 04 2016 07:12:01 GMT-0500 (Eastern Standard Time),,,Current Employee ,Great Company Overall,I have been working at Susquehanna International Group (SIG) full-time,6,Amazing company with an incredible culture. I work alongside extremely smart colleagues that are all passionate about our mission. Flat organization with a professional but relaxed culture.,"Given the flat nature of the organization, it can sometimes be hard to understand growth prospects.",,5.0,3.0,5.0,4.0,3.0,5.0,Recommends,Neutral Outlook,Approves of CEO
Mon Dec 14 2015 17:13:20 GMT-0500 (Eastern Standard Time),,, ,Software engineer,I have been working at Susquehanna International Group (SIG),5,Very good learning environment. Good benefits.,Cannot think any really. Pretty happy with most things,,5.0,5.0,5.0,5.0,5.0,2.0,Recommends,Positive Outlook,Approves of CEO
Thu Dec 10 2015 07:04:25 GMT-0500 (Eastern Standard Time),,, ,"Great company, good culture",I have been working at Susquehanna International Group (SIG),5,"Good people, good culture, good pay","Most of my college friends are in New York, while I work and live in Phily, if that counts as a con",,5.0,,,,,,Recommends,Positive Outlook,Approves of CEO
