date,employee_title,location,employee_status,review_title,years_at_company,helpful,pros,cons,advice_to_mgmt,rating_overall,rating_balance,rating_culture,rating_career,rating_comp,rating_mgmt,recommends,positive_outlook,approves_of_CEO
Sun Apr 05 2009 09:54:46 GMT-0400 (Eastern Daylight Time),,"Bala Cynwyd, PA","Trade Support Associate in Bala Cynwyd, PA","Stay away from SIG if you want respect from management, and want time to live a normal life.",I have been working at Susquehanna International Group (SIG),12,"The benefits are very good, and the work space itself is better than most offices. You definitely meet a lot of great people at SIG. You're surrounded by people who come from all over, and have something interesting to add to the work environment.","Micro-managing middle managers around every corner. The traders and the associates of SIG are the work horses, and the middle managers are simply around to perform damage control when the crap hits the fan...spreading the blame and recalling the situation as they see fit. Everyone understands that SIG is an ""intense"" and ""difficult"" environment. We get it. But the company shouldn't be run by fear. Many people find themselves hating their job because of unfair management, little recognition, or because SIG instills fear into employees to secure a certain result. SIG is both a super modern work environment, while also having a very archaic underbelly. Work would get done a lot quicker and smoother if not for problems being tackled by 10 managers and 4 associates. The managers waste half a day arguing about how a problem should be handled. Some people have been at SIG WAY TOO LONG. SIG is a good place to start a career, or expand a career. But dont stay there too long. The SIG culture is one of good things, and bad things. Its like the mofia. Once you're in, the perks are great and you feel secure. But once you cross them, watch out.",,2.0,1.5,3.0,4.0,2.0,,Doesn't Recommend,,Disapproves of CEO
Mon Mar 09 2009 20:22:56 GMT-0400 (Eastern Daylight Time),,"Bala Cynwyd, PA","Software Developer in Bala Cynwyd, PA",SIG - Good place to work,I have been working at Susquehanna International Group (SIG),0,"You will learn a lot on trading systems and business information on various desks, their TA program is very good for some one fresh out of the school and they have various rotation schedule which will give you an idea on what area of work you like to persue your career. Good for someone who likes to play poker as they have an annual event every year where all the employees are encouraged to participate which is very good and they have free lunches every day which is good/bad based on your food habits",No growth beyond team lead / manager in the information technology departments,,4.0,4.5,3.0,4.0,3.0,,Approves of CEO,,
Fri Jan 09 2009 13:31:54 GMT-0500 (Eastern Standard Time),,"Bala Cynwyd, PA"," in Bala Cynwyd, PA",SIG - Philly's least known best place to work,I have been working at Susquehanna International Group (SIG),2,"Laid back culture, collaborative atmosphere, emphasis on learning and development, benefits (free lunch, 401k matching program, gym on-site, yoga on-site, etc.)","Career path is not always cut and dry, but this can be a good thing, too.",,4.0,5.0,3.5,4.5,3.0,,Recommends,,Approves of CEO
Tue Nov 18 2008 09:10:56 GMT-0500 (Eastern Standard Time),,"Bala Cynwyd, PA"," in Bala Cynwyd, PA",Great opportunity to work with very smart people.,I have been working at Susquehanna International Group (SIG),0,Opportunity to work with some very bright people. Ability to work autonomously. Ability to contribute at many levels and in many areas.,Privately owned - not a lot of public information available.,,5.0,4.5,4.5,4.5,4.0,,Recommends,,Approves of CEO
Tue Nov 11 2008 05:31:56 GMT-0500 (Eastern Standard Time),,"Malvern, PA"," in Malvern, PA",Large company resources with a small company culture.,I have been working at Susquehanna International Group (SIG),0,"SIG has large company resources, but maintains a small company feel. Focus is on intellect and positive decision making, rather than bureaucracy or process for process sake. Perks abound, with: free breakfast and lunch, free onsite healthcare, free onsite physical fitness center, casual work environment (jeans, sneakers), etc.. The firm's leadership does a great job of maintining the culture by living the example themselves. Also, poker is used as a teaching tool, with roots back to the foundation of the firm. You'll quickly be the best player at any garage or basement game!","Communication doesn't always flow down or across well, leading to questions about the prioritization of projects or other initiatives.",,5.0,4.5,4.0,5.0,5.0,,Recommends,,Approves of CEO
Mon Oct 27 2008 05:21:38 GMT-0400 (Eastern Daylight Time),,"Bala Cynwyd, PA"," in Bala Cynwyd, PA",Many Employee Perks,I have been working at Susquehanna International Group (SIG),0,"Very modern in their way of thinking and they are always open to new ideas. There are many employee perks: free breakfast and lunch, onsite doctor, gym, tailor, barber, etc.","I would be more interested to know what issues the company is facing, that seems to be kept behind closed doors. They look for ideas to help, but if the employees don't know the problem, how can they help? The one thing they are not leading the market with is flextime.",,4.0,3.5,3.0,4.0,3.5,,Recommends,,Approves of CEO
Thu Oct 16 2008 18:50:25 GMT-0400 (Eastern Daylight Time),,"Bala Cynwyd, PA","Quantitative Research Associate in Bala Cynwyd, PA",A great place to work and learn.,I have been working at Susquehanna International Group (SIG),0,SIG offers a vast array of possibilities for professional development - you can go into any direction that interests you.,Some personnel is working under very strict non-compete agreements. They do facilitate the open exchange of information but make it very difficult to move your skills to another company.,,5.0,5.0,4.5,3.5,5.0,,Recommends,,Approves of CEO
Fri Sep 26 2008 10:58:16 GMT-0400 (Eastern Daylight Time),,"Philadelphia, PA","Software Developer in Philadelphia, PA","Great resources, good culture - just beware of stagnation if you're a technologist.",I have been working at Susquehanna International Group (SIG),3,"SIG has a very open and merit based culture. Where as a lot of companies say they run like a startup and have a meritocracy, SIG actually for the most part adhere's to this policy closely and is reflected from most of the managers down to the rank and file employees. There are a lot of different groups - even with technology, within SIG. Once you are here, there's a lot of potential to transition laterally if you find a particular interest (Market data, security, server-side, client-side, database..etc) and if you want to work close to the desk/traders, you generally can get that opportunity working for most of the groups here. The employee review structure is fair and a lot of attention is paid to compensation and performance review. Star performers are rewarded based on their contributions and it is possible to come here, do a great job, and reap the benefits - however, there is a limited upside as a technology employee here. The lions share of the bonuses goes towards traders and head traders here.","The counter-point to the relative flat structure and merit-based culture is, with the growth that they have been experiencing, especially in technology, the employee structure can feel a little hierarchical in the end and what you do can increasingly feel pigeon-holed. There's a lot of initiatives going on, a lot of projects flowing, but it's easy to increasingly feel like a cog in the wheel without actively going out and ask people from other departments are doing. If you are just starting out, especially in financial/trading industry, you might be better served working for a startup or boutique just to get the opportunity to do a little bit of everything and carve out a niche for yourself. To prevent yourself from settling into a cycle of overspecialization or monotony here, you definitely have to be mindful of actively asking for new projects and growth opportunities. There are some internal competition here as well, from each trading/technology group, as well as internal competition among workers in a particular group. The best technology people within software develop usually get new development projects and architectural leeway, whereas the middle of the pack and lower end performers get stuck supporting legacy systems. To some people, doing support and incremental fixes to existing systems is a safe and stressful job and they are okay with it. If you are particularly interested in writing performance intensive code or novel low level system code, you should specify that and try to get out of legacy support duties as soon as possible.",,4.0,4.0,3.0,4.0,3.0,,Recommends,,Approves of CEO
Mon Jun 30 2008 16:57:38 GMT-0400 (Eastern Daylight Time),,"Bala Cynwyd, PA"," in Bala Cynwyd, PA",Growing company with good people and good culture,I have been working at Susquehanna International Group (SIG),0,"Small office feel and very open culture, but still giving big firm opportunities. Also it is trading firm which values its technologists and recognizes the value technology brings to its businesses.","Traffic around Bala Cynwyd, PA office can be nightmare, especially since the nature of SIG's business mandates rigid work hours.",,5.0,3.5,4.5,3.0,4.5,,Recommends,,Approves of CEO
Wed Jun 11 2008 19:10:51 GMT-0400 (Eastern Daylight Time),,"Bala Cynwyd, PA","Software Developer in Bala Cynwyd, PA","Susquehanna International Group- Big Firm Resources, Small Firm Feel",I have been working at Susquehanna International Group (SIG),2,"Susquehanna International Group is a very fast growing company that affords plenty of opportunities for advancement. While other places claim to be meritocracies, Susquehanna truly is. Their recruiting standards are very high, so you are guaranteed to work with numerous smart and ambitious young people. The culture is very supportive and free of the pointless bureaucracy that plagues the larger firms in the business.","As Susquehanna International Group is a fast growing company, it takes a lot of work on behalf of the employees to sustain this level of growth.",,5.0,3.5,5.0,4.5,5.0,,Recommends,,Approves of CEO
Thu Jun 12 2008 06:28:37 GMT-0400 (Eastern Daylight Time),,"Bala Cynwyd, PA","Business Systems Analyst  in Bala Cynwyd, PA",Grow with SIG!,I have been working at Susquehanna International Group (SIG),2,"In this environment, you truly need to work smart. You are challenged each day in a vast assortment of ways to find solutions, to make things better, to help everyone achieve more. We don't mind losing or making mistakes, but we sure want to win at least 51% of the time! It pays to be forward-thinking, creative, daring and innovative. This company works as a meritocracy - meaning that your work (not only projects or tasks or trade PnL, but style, dynamic) is noticed, noted, and duly rewarded as warranted. Top Reasons: The Person is Respected Family Matters A LOT! You have a voice You are visible to all levels of management Benefits Package is very good On-site Fitness Center Lunch is catered every day","One problem is the commute. IF you live anywhere beyond Bala Cynwd or Narberth, you're at the mercy of the morning 76, 95, Route 1, City Avenue quagmire. Getting here can be a real bear in the morning...and it's not much easier getting out at the end of the day. Business-wise, you need to realize that we are working at the speed of the markets ebb and flow. Thus, one day, something you're working on is the highest priority, and the next, it can be shelved for something that is of even greater importance and needs to be done on the fly. There isn't alot of time to document scope or script change control procedures, and if you're coming from a more formalized development house, then that takes a little getting used to. SIG has been growing ever since its founding days, and what was once a small shop for options traders has grown into a global player in all markets. There is a lot of adjustment in that rapid expansion, so we're constantly trying out new ways to mitigate risk and maximize development time. This leads to some frustrations from old-world to new-world methodologies and mentalities.",,4.0,5.0,4.5,4.0,4.0,,Recommends,,Approves of CEO
Wed Mar 25 2020 11:05:22 GMT-0400 (Eastern Daylight Time), Support Engineer,"Dublin, Dublin",Current Employee ,Good company to work for,I have been working at Susquehanna International Group (SIG) full-time for more than 3 years,0,"Healthcare plan, free lunch, pay towards pension.",Limited promotion prospects. Limited training.,,4.0,4.0,4.0,2.0,5.0,4.0,Recommends,Positive Outlook,Approves of CEO
Sun Jan 12 2020 16:45:43 GMT-0500 (Eastern Standard Time),,,Former Employee ,Equity Research Analyst,I worked at Susquehanna International Group (SIG) full-time,0,"Fast paced, smartest professional in the trading industry. Unreal perks.",Hardly any cons to comment.,,5.0,5.0,5.0,4.0,5.0,5.0,Recommends,Positive Outlook,Approves of CEO
Mon Dec 23 2019 02:14:49 GMT-0500 (Eastern Standard Time), Software Developer,Sydney,Current Employee ,comfortable,I have been working at Susquehanna International Group (SIG) full-time for more than 3 years,1,"great office, good benefits, free breakfast and lunch, no overtime, friendly people","always busy, priority on speed over quality and maintainability, old legacy systems with poor code quality and no focus on improving, limited exposure to new tech",,4.0,4.0,5.0,1.0,5.0,4.0,Neutral Outlook,,No opinion of CEO
Thu Nov 14 2019 04:07:32 GMT-0500 (Eastern Standard Time),,,Former Employee ,Good for engineering,I worked at Susquehanna International Group (SIG) full-time,0,"Great benefits, good work environment, nice people.","Nothing major, occasionally long hours",,4.0,3.0,4.0,4.0,5.0,4.0,Recommends,,No opinion of CEO
Sun Nov 03 2019 09:46:00 GMT-0500 (Eastern Standard Time),,,Current Employee ,Employee review,I have been working at Susquehanna International Group (SIG) full-time,0,Free Gym and lunch. V Smart people,Smart people become managers naturally even if not well suited,,4.0,3.0,4.0,4.0,4.0,3.0,Recommends,Neutral Outlook,No opinion of CEO
Sat Oct 12 2019 12:18:05 GMT-0400 (Eastern Daylight Time),,,Current Employee ,Analyst,I have been working at Susquehanna International Group (SIG) full-time,1,"Healthcare, dental, food, pension, location","No promotion prospects, bad management",,3.0,4.0,3.0,3.0,4.0,1.0,Disapproves of CEO,,
Sat Sep 07 2019 13:27:51 GMT-0400 (Eastern Daylight Time), Linux Systems Administrator,Sydney,Current Employee ,Best job ever,I have been working at Susquehanna International Group (SIG) full-time for more than a year,1,"The people are friendly, wonderful and smart. the managers are switched on and supportive and don't micromanage. Its a pleasure to work here.",In all my time at SIG the worst thing I can say is that when people move on I miss them.,,5.0,5.0,5.0,4.0,4.0,4.0,Recommends,Positive Outlook,Approves of CEO
Fri Oct 11 2019 18:01:17 GMT-0400 (Eastern Daylight Time), Finance,"Dublin, Dublin",Former Employee ,Bully and harassment of employees. Negative vibe. If you are considering joining the finance team. RUN,I worked at Susquehanna International Group (SIG) full-time for more than 5 years,4,"Gym, free food, healthcare and pension","Heavy workload, no support, lack of training. Bullying and harassment on the floor in front of colleagues accepted and encouraged. No support available and progression is not possible. Squeeze as much as they can from you for a low salary.","Thank you for taking the time to post a review. We were disappointed and surprised to read what you had to say as we are committed to ensuring that SIG is a place where our employees thrive, feel supported and encouraged, and are treated with dignity and respect. Management takes any claim of bullying and harassment very seriously. This type of behaviour is not tolerated and we have comprehensive policies, procedures, and training in place to ensure a positive work environment for all employees. SIG is a collaborative environment where all employees are encouraged to give regular feedback, whether in team meetings, through 1:1 meetings with their manager, or directly to HR or management. When interpersonal issues arise, as they inevitably will in any work environment, we strive to handle these issues with sensitivity and consideration to all involved. Many thanks, Paula Duffy",1.0,1.0,1.0,2.0,1.0,1.0,Doesn't Recommend,Negative Outlook,No opinion of CEO
Fri Aug 02 2019 15:24:05 GMT-0400 (Eastern Daylight Time), IT Engineer,"Dublin, Dublin",Former Employee ,Excellent Company,I worked at Susquehanna International Group (SIG) full-time for more than 3 years,4,I worked across 3 different teams at Susquehanna Dublin. I have nothing but positives to say. Really good people and top engineers. Great percs too. Got a great opportunity to learn and work with the best infrastructure setup I have ever come across.,For me there were no downsides to working here.,,5.0,5.0,5.0,5.0,5.0,5.0,Recommends,Positive Outlook,Approves of CEO
Mon Aug 26 2019 14:35:52 GMT-0400 (Eastern Daylight Time), Trader,"Dublin, Dublin",Current Employee ,Trader,I have been working at Susquehanna International Group (SIG) full-time for more than 3 years,0,"Working with smart people,
Sharp learning curve","Long working hours,
Work under pressure",,3.0,1.0,2.0,4.0,3.0,3.0,Recommends,Positive Outlook,Approves of CEO
Thu Aug 22 2019 13:03:47 GMT-0400 (Eastern Daylight Time), Senior Manager,,Former Employee ,Not all that it seems,I worked at Susquehanna International Group (SIG) full-time for more than 3 years,7,"free food, nice offices, free gym","poor team environment, poor communication to employees - things are always ""need to know"" basis, bad management team, arrogant head, lack of ability to be promoted or move teams - when you're hired that's the only job you're expected to do",,1.0,1.0,2.0,1.0,2.0,1.0,Doesn't Recommend,Neutral Outlook,No opinion of CEO
Fri Aug 23 2019 13:38:47 GMT-0400 (Eastern Daylight Time), Equity Research Analyst,"Dublin, Dublin",Former Employee ,Hell on Earth,I worked at Susquehanna International Group (SIG) full-time for more than a year,5,"Free food, Gym, management are very friendly","Horrific working hours, mundane work, unnecessarily pressured environment, chained to your desk, no breaks, 6:30 am starts, no overtime pay, low salary, no progression and deliberately hires people that have no prior experience so they don't know how much nicer working somewhere else is. A lot of very jealous people work here. My advice is very simple, if your smart enough to get a job here, don't be stupid enough to stay.",,1.0,1.0,3.0,1.0,1.0,4.0,Doesn't Recommend,Negative Outlook,No opinion of CEO
Mon Jul 29 2019 08:01:59 GMT-0400 (Eastern Daylight Time), Senior Software Engineer,"Dublin, Dublin",Former Employee ,Good company with a lot of perks,I worked at Susquehanna International Group (SIG) full-time for more than a year,1,A lot of perks (not outstanding salary) Relaxed environment Not too much pressure,Trading centric company very difficult for tech people to make an impact Tech contribution is difficult to gauge because tied to trading activities,,3.0,5.0,1.0,2.0,3.0,4.0,Recommends,,No opinion of CEO
Mon Jun 10 2019 10:50:11 GMT-0400 (Eastern Daylight Time), Operations Analyst,"Dublin, Dublin",Former Employee ,Operational analyst at Dublin office,I worked at Susquehanna International Group (SIG) full-time for more than 3 years,0,"Great perks, free gym, free food. Nice working environment and people.",Little room for progression - flat structure. Some boring aspects of the job.,,4.0,4.0,4.0,3.0,5.0,4.0,Recommends,Neutral Outlook,Approves of CEO
Fri May 17 2019 08:28:07 GMT-0400 (Eastern Daylight Time), Options Trader,,Former Employee ,Fantastic company to learn the ropes,I worked at Susquehanna International Group (SIG) full-time for more than 8 years,2,"Great education program for traders - it will change the way you think, forever, in a really good way. Pretty much everyone you work with is extremely intelligent. As Susquehanna are an industry leader you will be exposed to many aspects of the market landscape and see things from a bird's eye view. It's a very interesting and collaborative place to work.","While I had a gripe here and there, no major cons. Every institution has its imperfections, none were really deal breakers and overall Susquehanna is a solid place to work.",,5.0,5.0,5.0,5.0,3.0,5.0,Recommends,Positive Outlook,Approves of CEO
Wed Apr 24 2019 09:10:32 GMT-0400 (Eastern Daylight Time),,,Current Employee ,Operations Analyst,I have been working at Susquehanna International Group (SIG) full-time,3,"Free food, good pension, good work life balance","Lack of progression, very little advice and attention from managers",,4.0,4.0,4.0,3.0,4.0,4.0,Recommends,Positive Outlook,Approves of CEO
Sun Mar 24 2019 22:56:40 GMT-0400 (Eastern Daylight Time), Senior Data Engineer,"Dublin, Dublin",Former Employee ,Data Eng - SIG,I worked at Susquehanna International Group (SIG) full-time for more than 8 years,2,"no body needs to talk about work life balance, good salary, nice ppl, nice office","Located in dublin city centre,",,4.0,5.0,3.0,4.0,5.0,4.0,Recommends,Positive Outlook,
Wed Apr 24 2019 11:28:48 GMT-0400 (Eastern Daylight Time), Infrastructure Engineer,"Dublin, Dublin",Former Employee ,Toxic environment and outdated management,I worked at Susquehanna International Group (SIG) full-time for more than 5 years,13,- free on-site gym - Free food from KC Peaches (not always the best quality) - Employer contributory pensions - Get to play with the newest hardware,"- Bullying is rampant. If you go to team leads or management, you are either laughed at or told to fix it yourself (like in my case). - There is a big blame culture. You have to have everything documented to cover your back if something goes wrong; even then, it might not be enough. - Management don't care about your personal life or other commitments. You are expected to drop everything for them when they say so. There is no work/life balance, only work. - Management decisions that negatively affect employees personal life take no consideration of the employees opinion or concerns. - The only staff that are valued here are the traders. If you work in IT (which is the majority of the company), they do not care about you. They held ""stay interviews"" to see what they could do better to stop employees leaving. The only employees that were interviewed were traders. - 10-12 hours days can be common. - No one moves up the management ladder, everyone else moves down. - Appears that management don't really know what they're doing. They'll announce something one week and then change their mind a couple of weeks later. - There is no remote working option. You are expected to be in the office everyday.",,1.0,1.0,1.0,2.0,1.0,1.0,Doesn't Recommend,Negative Outlook,Disapproves of CEO
Mon Mar 04 2019 20:45:14 GMT-0500 (Eastern Standard Time),,,Current Employee ,Great Culture,I have been working at Susquehanna International Group (SIG) full-time for less than a year,2,"Lovely people, great culture - very open and friendly and encouraging of learning.",Still too early to say,,5.0,,,,,,,,
Wed Feb 20 2019 22:57:22 GMT-0500 (Eastern Standard Time),,,Former Employee ,Great place to learn and grow,I worked at Susquehanna International Group (SIG) full-time,1,Excellent place for young aspiring folks to accelerate their learning curve,"At times, can be chaotic with conflicting priorities",,4.0,,,,,,,,
Sat Jan 19 2019 05:58:18 GMT-0500 (Eastern Standard Time),,,Former Employee ,OA,I worked at Susquehanna International Group (SIG) full-time,0,"Great experience. Nice colleagues, willing to help. Good training programme, specifically in terms of tech",Lack of career opportunities in general,,4.0,4.0,4.0,2.0,5.0,4.0,Recommends,Neutral Outlook,No opinion of CEO
Sun Jan 20 2019 12:45:38 GMT-0500 (Eastern Standard Time),,"Dublin, Dublin",Former Employee ,Good place to learn but awful management,I worked at Susquehanna International Group (SIG) full-time for less than a year,7,"* Learn lots, especially from a coding point of view * Smart colleagues (though this can cause major arrogance amongst some) * Perks are great, e.g. free lunches, healthcare * Location in Dublin is great","* Hours can be long, especially for starters * Support networks are poor. Any admission of requiring help is used as a negative * Approach to training is much more stick than carrot -- to an extent that, to my mind, borders on bullying. * Isolating amongst some teams. Can spend whole days without speaking to any colleague.",,2.0,2.0,1.0,3.0,4.0,2.0,Doesn't Recommend,Neutral Outlook,No opinion of CEO
Wed Jan 09 2019 10:38:05 GMT-0500 (Eastern Standard Time),,, ,Buyside Research Summer Analyst,I worked at Susquehanna International Group (SIG),1,"- Great hours (7-5:30/6:30) - Tight knit team of around 25-30 people - Firm with strong culture and great community of people, despite being a large firm","- Get paid much less than traders and tech - Fast paced throughout the day (if this is a con for you, this job is not for you)",,5.0,5.0,5.0,4.0,4.0,5.0,Recommends,Positive Outlook,Approves of CEO
